product_name,product_ticker,category,release_date,sale_count,average_sale_price,topic,material,special_version,search_volume
Funko Pop! Ad Icons Pillsbury Pillsbury Doughboy with Shamrock Spring Convention Figure #41,F-POAIPPD41,ad-icons,,3,41.66666667,pillsbury doughboy,no,spring_convention,44000
Funko Pop! Ad Icons Big Boy (Sunglasses) Hollywood Exclusive Figure # 74,F-POAIBBS74,ad-icons,,10,60,big boy,no,hollywood_exclusive,40000
Funko Pop! Ad Icons Rice Krispies Snap! Crackle! Pop! Funko Shop Limited Edition 3 Pack,F-POAIRKSCK,ad-icons,,10,33.1,rice krispies,no,funko_shop_limited,24000
Funko Pop! Ad Icons Kellogs Froot Loops Toucan Sam Baja Scholership Foundation Limited Edition Figure #13,FPO-IKFLTFLEF13,ad-icons,,10,250.3,froot loops,no,limited,36000
Funko Pop! Ad Icons Cheetos Chester Cheetah Figure #77,F-POAICCC77,ad-icons,,10,22,chester cheetah,no,no,12000
Funko Pop! Ad Icons Coca-Cola Polar Bear Figure #58,F-POAICPB58,ad-icons,,10,25.1,coca-cola polar bear,no,no,70
Funko Pop! Ad Icons Target Bullseye Red Collar (Flocked) Target Exclusive Figure #05,F-POAITBR05,ad-icons,8/1/2019,10,31.4,target bullseye,flocked,target_exclusive,3900
Funko Pop! Ad Icons Kelloggs Fruit Loops Toucan Sam Funko Shop Exclusive Figure #13,FPO-AIKFLTSEF13,ad-icons,12/23/2018,10,150.1,froot loops,no,funko_shop_limited,36000
Funko Pop! Ad Icons Energizer Bunny Figure #73,F-POAIEBF73,ad-icons,,8,20,energizer bunny,no,no,14000
Funko Pop! Ad Icons Coca Cola Polar Bear (Flocked) Funko Shop Limited Edition Figure #58,F-POAICCP58,ad-icons,,10,32.6,coca-cola polar bear,no,funko_shop_limited,70
Funko Pop! Ad Icons Trix Rabbit (Flocked) Funko Shop Exclusive Figure #10,F-POAITTR10,ad-icons,10/22/2017,10,121.1,trix rabbit,flocked,funko_shop_limited,2200
Funko Pop! Ad Icons Kelloggs Frosted Flakes Tony the Tiger Funko Shop Exclusive Figure #08,F-POAIKFF08,ad-icons,3/17/2017,6,196,frosted flakes,no,funko_shop_limited,24000
Funko Pop! Ad Icons Smokey Bear Figure #75,F-POAISBF75,ad-icons,,5,20.6,smokey bear,no,no,9100
Funko Pop! Ad Icons Toys R Us Marvel Geoffrey as Iron Man Canadian Convention Exclusive Bobble Head Figure #29,F-POAITRU29,ad-icons,,8,29.25,toys r us geoffrey,no,canadian_convention,600
Funko Pop! Ad Icons Lucky Charms Lucky Leprechaun Funko Shop Exclusive Figure #11,FPO-AILCLLEFG11,ad-icons,10/1/2017,8,97.375,lucky leprechaun,no,funko_shop_limited,700
Funko Pop! Ad Icons StarKist Charlie The Tuna Funko Shop Limited Edition Figure #54,F-POAISCT54,ad-icons,,6,257.3333333,starkist charlie,no,funko_shop_limited,80
Funko Pop! Ad Icons Chester Cheetah (Bag) (Sunglasses) Hollywood Exclusive Figure # 78,F-POAICCW78,ad-icons,,10,53,chester cheetah,no,hollywood_exclusive,12000
Funko Pop! Ad Icons Bullseye Target Con Exclusive Figure #118,F-POAIBTC18,ad-icons,2/26/2021,5,33.4,target bullseye,no,convention_exclusive,3900
Funko Pop! Ad Icons Smokey Bear Funko Shop Limited Edition Figure #76,F-POAISBF76,ad-icons,,5,31,smokey bear,no,funko_shop_limited,9100
Funko Pop! Ad Icons Cap'n Crunch Target Exclusive Figure #14,F-POAICCT14,ad-icons,,6,22.16666667,cap'n crunch,no,target_exclusive,7700
Funko Pop! Ad Icons Energizer Bunny (Flocked) Funko Shop Limited Edition Figure #73,F-POAIEB73,ad-icons,,3,29.66666667,energizer bunny,flocked,funko_shop_limited,14000
Funko Pop! Ad Icons Cheetos Chester Cheetah (Diamond) Funko Shop Exclusive Figure #77,F-POAICCCF77,ad-icons,,3,25.33333333,chester cheetah,no,funko_shop_limited,12000
Funko Pop! Ad Icons Monster Cereals Fruit Brute Funko Shop Exclusive Figure #06,F-POAIMCF06,ad-icons,5/18/2017,4,133.75,monster cereals,no,funko_shop_limited,2700
Funko Pop! Ad Icons Target Bullseye Gold Collar (Flocked) Target Exclusive Figure #05,F-POAITBG05,ad-icons,,4,27,target bullseye,flocked,target_exclusive,3900
Funko Pop! Ad Icons Pillsbury Doughboy Be Mine Funko Shop Edition Figure #93,F-POAIPDB93,ad-icons,,3,30.66666667,pillsbury doughboy,no,funko_shop_limited,44000
Funko Pop! Ad Icons Jollibee (Metallic) Figure #30,F-POAIJF30,ad-icons,,2,125,jollibee,metallic,no,193000
Funko Pop! Ad Icons Lucky Charms Lucky Leprechaun (Glow) Funko Shop Exclusive Figure #11,FPO-AILCLLGEF11,ad-icons,12/23/2018,6,100.3333333,lucky leprechaun,glow,funko_shop_limited,700
Funko Pop! Ad Icons Hostess Twinkies Twinkie The Kid Figure #27,FPO-AIHTTTKF27,ad-icons,,4,18,twinkie the kid,no,no,800
Funko Pop! Ad Icons Icee Icee Polar Bear Funko Shop Limited Edition Figure #72,FPO-AIIIPBLEF72,ad-icons,,2,66,icee polar bear,no,funko_shop_limited,250
Funko Pop! Ad Icons Target Bullseye (Gold Collar) (Flocked) Target Exclusive SDCC Figure #05,F-POAITB05,ad-icons,,2,70,target bullseye,flocked,target_exclusive,3900
Funko Pop! Ad Icons Pez Peter Pez Toy Tokyo Exclusive Figure #52,FPO-AIPPPTTEF52,ad-icons,,1,24,peter pez,no,tokyo_exclusive,40
Funko Pop! Ad Icons Cocoa Puffs Sonny the Cuckoo Funko Shop Exclusive Figure #09,F-POAICPS09,ad-icons,10/1/2017,2,101,sonny the cuckoo,no,funko_shop_limited,250
Funko Pop! Ad Icons San Diego Comicon Toucan Summer Convention Exclusive Figure #53,FPO-AISDCTSCF53,ad-icons,,2,20,comic con toucan,no,summer_convention,10
Funko Pop! Ad Icons Otter Pops Louie-Bloo Raspberry SDCC Figure #48,F-POAIOPL49,ad-icons,7/17/2019,1,800,louie-bloo raspberry,no,SDCC,10
Funko Pop! Ad Icons Trix Rabbit Funko Shop Exclusive Figure #10,F-POAITRF10,ad-icons,10/1/2017,2,75,trix rabbit,no,funko_shop_limited,2200
Funko Pop! Ad Icons Honey Nut Cheerios Buzz Funko Shop Limited Edition Figure #21,F-POAIHNC21,ad-icons,,2,31.5,honey nut cheerios buzz,no,funko_shop_limited,90
Funko Pop! Ad Icons Toys R Us Canada DC Geoffrey as Batman Toys R Us Exclusive Figure #69,F-POAITRU69,ad-icons,,2,34.5,toys r us geoffrey,no,toys_r_us_exclusive,600
Funko Pop! Ad Icons Frosted Flakes Tony the Tiger (Flocked) Funko Shop Exclusive Figure #08,F-POAIFFT08,ad-icons,10/22/2017,2,400,frosted flakes,flocked,funko_shop_limited,24000
Funko Pop! Ad Icons Domino's The Noid Target Exclusive Figure #17,F-POAIDTN17,ad-icons,,2,17.5,the noid,no,target_exclusive,14000
Funko Pop! Ad Icons Cap'n Crunch Jean LaFoote Funko Shop Limited Edition Figure #16,F-POAICCJ16,ad-icons,,1,65,cap'n crunch,no,funko_shop_limited,7700
Funko Pop! Ad Icons Jollibee Jollibee in Philippine Barong (Glow) Hobbiestock Exclusive Figure #51,FPO-AIJJIPBGH51,ad-icons,,1,45,jollibee,glow,funko_shop_limited,193000
Funko Pop! Ad Icons Hostess Cupcakes Captain Cupcakes Funko Shop Limited Edition Figure #66,FPO-AIHCCLFEF66,ad-icons,,1,21,captain cupcakes,no,funko_shop_limited,10
Funko Pop! Ad Icons Jollibee Jollibee in Philippine Barong Philippine Independence Day Exclusive Figure #51,FPO-AIJJIPBID51,ad-icons,,6,36,jollibee,no,philippine,193000
Funko Pop! Ad Icons Smokey Bear (Flocked) Hot Topic Exclusive Figure #75,F-POAISB75,ad-icons,,2,33.5,smokey bear,flocked,hot_topic_exclusive,9100
Funko Pop! Animation My Hero Academia Dabi Fall Convention Figure #637,F-POAMHA37,anime,,10,135.5,dabi,no,fall_convention,274000
Funko Pop! Animation Attack on Titan Beast Titan Hot Topic Exclusive 6 inch Figure #504,F-POAAOTB04,anime,,10,109.3,beast titan,no,hot_topic_exclusive,84000
Funko Pop! Animation Naruto Shippuden Naruto (Sage Mode) Gamestop Exclusive Figure #185,F-POANSN85,anime,12/27/2016,10,60.4,naruto,no,gamestop_exclusive,1100000
Funko Pop! Animation Naruto Shippuden Kakashi (Lightning Blade) Hot Topic Exclusive Figure #548,F-POANSK48,anime,,10,35.3,kakashi,no,hot_topic_exclusive,301000
Funko Pop! Animation One Piece Trafalgar. Law Figure #101,F-POAOPTL01,anime,,10,374.7,trafalgar law,no,no,65000
Funko Pop! Animation Naruto Shippuden Kurama (Flocked) Hot Topic Exclusive Figure #73,F-POANSK73,anime,,10,51.7,kurama,flocked,hot_topic_exclusive,101000
Funko Pop! Animation Dragon Ball Super SSG Goku Summer Convention Exclusive Figure #827,F-POADBSS26,anime,7/22/2020,10,47.3,goku,no,summer_convention,318000
Funko Pop! Animation Attack on Titan Levi Figure #235,F-POAAOTL35,anime,,10,36.3,levi,no,no,401000
Funko Pop! Animation Dragonball Super Super Saiyan Rose Goku Black Hot Topic Exclusive Figure #260,F-POADSSS60,anime,,10,36.5,goku,no,hot_topic_exclusive,318000
Funko Pop! Animation One Piece Tony Tony Chopper (Flocked) Funimation Exclusive Figure #99,F-POAOPTT99,anime,5/6/2016,10,224.9,tony tony chopper,flocked,funimation_exclusive,36000
Funko Pop! Animation Dragonball Z Jiren Convention Exclusive Figure #516,F-POADZJC16,anime,,6,34.16666667,jiren,no,convention_exclusive,68000
Funko Pop! Animation My Hero Academia All Might Funimation Exclusive Figure #248,FPO-AMHAAMFF248,anime,,4,52.25,all might,no,funimation_exclusive,256000
Funko Pop! Animation Dragonball Z Beerus (Flocked) Funimation Exclusive Figure #514,F-POADZB14,anime,,10,53.5,beerus,flocked,funimation_exclusive,74000
Funko Pop! Animation My Hero Academia Katsuki Bakugo Summer Convention Exclusive Figure #803,F-POAMHAK0,anime,7/22/2020,10,93.4,katsuki bakugo,no,summer_convention,30000
Funko Pop! Animation Naruto Shippuden Itachi AEC Exclusive Figure #578,F-POANSIA78,anime,,10,54,itachi,no,aec_exclusive,227000
Funko Pop! Animation Dragonball Z Great Ape Vegeta Fall Convention Figure #434,F-POADZGA34,anime,,10,47.2,vegeta,no,fall_convention,164000
Funko Pop! Animation My Hero Academia All Might (Glow) Funimation Exclusive Figure #248,FPO-AMHAAMGF248,anime,10/1/2017,10,126,all might,glow,funimation_exclusive,256000
Funko Pop! Animation One Piece Brook Funko Fall Convention Figure #358,FPO-AOPBFFCF358,anime,11/3/2018,10,322.4,brook,no,fall_convention,63000
Funko Pop! Animation Dragonball Super Goku (Ultra Instinct) Figure #386,F-POADSG86,anime,,10,28.1,goku,no,no,318000
Funko Pop! Animation My Hero Academia Hero Killer Stain Fall Convention Figure #636,F-POAMHAHK36,anime,,10,49.7,killer stain,no,fall_convention,14000
Funko Pop! Animation DragonBall Z Whis (Metallic) SDCC Figure #317,F-POADZW17,anime,11/27/2018,10,94.3,whis,metallic,SDCC,30000
Funko Pop! Animation Nartuo Shippuden Sasuke (Curse Mark) Convention Exclusive Figure #455,F-POANSS55,anime,,10,69.1,sasuke,no,convention_exclusive,271000
Funko Pop! Animation Naurto Shippuden Naurto Uzumaki (Sexy Jutsu) Box Lunch Exclusive Figure #726,F-POANSNU26,anime,,10,32.9,uzumaki,no,box_lunch_exclusive,122000
Funko Pop! Animation Naruto Shippuden Kakashi Figure #182,F-POANSKF82,anime,,10,33.7,kakashi,no,no,301000
Funko Pop! Animation Naruto Shippuden Kaguya Otsutsuki Fall Convention Exclusive Figure #179,F-POANSKO79,anime,10/8/2020,10,47.4,kaguya otsutsuki,no,fall_convention,20000
Funko Pop! Animation Naruto Shippuden Tobi Figure #184,F-POANSTF84,anime,,10,35.7,tobi,no,no,161000
Funko Pop! Animation Naruto Shippuden Naruto Uzumaki (Six Path) (Glow) Hot Topic Exclusive Figure #186,F-POANSNU86,anime,1/14/2017,10,64.4,uzumaki,glow,hot_topic_exclusive,122000
Funko Pop! Animation My Hero Academia Mr.Compress Fall Convention Exclusive Figure #820,F-POAMHAM2,anime,10/8/2020,10,18.4,mr compress,no,fall_convention,22000
Funko Pop! Animation Dragonball Z Resurrection F Golden Frieza Summer Convention Figure #47,F-POADZRF47,anime,,10,95,frieza,no,summer_convention,76000
Funko Pop! Animation My Hero Academia Tenya Figure #250,F-POAMHAT50,anime,6/1/2017,10,180.2,tenya,no,no,57000
Funko Pop! Animation My Hero Academia Ochaco (Masked) SDCC Figure #253,F-POAMHAO53,anime,6/1/2017,10,363.8,ochaco,no,SDCC,52000
Funko Pop! Animation Dragonball Z Super Saiyan Goku (Glow) Entertainment Earth Exclusive Figure #14,F-POADZSS145,anime,,10,26.2,goku,glow,earth_exclusive,318000
Funko Pop! Animation Yu-Gi-Oh! Dark Magician Hot Topic Exclusive Figure #595,F-POAYDMH95,anime,,10,29.7,dark magician,no,hot_topic_exclusive,45000
Funko Pop! Animation Soul Eater Soul Figure #79,F-POASESF79,anime,,10,127.1,soul eater,no,no,171000
Funko Pop! Animation My Hero Academia All Might (Weakened) Box Lunch Exclusive Figure #648,F-POAMHAA48,anime,,10,42.5,all might,no,box_lunch_exclusive,256000
Funko Pop! Animation Sword Art Online Asuna Figure #81,FPO-ASAONASFG81,anime,,10,166.9,asuna,no,no,77000
Funko Pop! Animation Dragonball Z Super Super Saiyan Rose Hot Topic Exclusive Figure #260,F-POADZSS60,anime,,10,28.8,super saiyan rose,no,hot_topic_exclusive,16000
Funko Pop! Animation Naurto Shippuden Gaara Figure #728,F-POANSGF28,anime,,10,32.3,gaara,no,no,150000
Funko Pop! Animation Boruto Naruto (Hokage) AAA Anime Exclusive Figure #724,F-POABNA24,anime,,10,26.3,boruto naruto,no,aaa_anime_exclusive,23000
Funko Pop! Animation DragonBall Z Beerus (Metallic) SDCC Figure #120,F-POADZB20,anime,6/15/2016,10,209.1,beerus,metallic,SDCC,74000
Funko Pop! Animation Dragonball Z Super SSGSS Goku (Kamehameha) Chalice Collectibles Exclusive Figure #563,F-POADZSS63,anime,,10,24.3,goku,no,chalice_exclusive,318000
Funko Pop! Animation My Hero Academia Deku (Glow) Entertainment Earth Exclusive Figure #596,F-POAMHAD96,anime,,10,29.8,deku,glow,earth_exclusive,451000
Funko Pop! Animation Attack On Titan Mikasa Ackerman Figure #21,F-POAAOTM21,anime,7/14/2014,10,200.3,mikasa ackerman,no,no,122000
Funko Pop! Animation My Hero Academia Ochaco Uraraka Funimation Exclusive Figure #887,F-POAMHAO8,anime,,10,35.8,ochaco uraraka,no,funimation_exclusive,52000
Funko Pop! Animation Attack on Titan Armored Titan 6 inch Figure #234,F-POAAOTA34,anime,,10,226.8,armored titan,no,no,36000
Funko Pop! Animation Dragon Ball Super SSG Goku SDCC Exclusive Figure #827,F-POADBSS27,anime,7/22/2020,10,80.9,goku,no,SDCC,318000
Funko Pop! Animation Dragonball Z Porunga Spring Convention Exclusive Figure #550,F-POADZPS50,anime,,10,27.7,porunga,no,spring_convention,1600
Funko Pop! Animation My Hero Academia Todoroki (Glow) Convention Exclusive Figure #372,F-POAMHATC72,anime,,10,45.2,todoroki,glow,convention_exclusive,480000
Funko Pop! Animation Dragonball Super Vegeta Poweing Up (Glow) Chalice Collectibles Exclusive Figure #713,F-POADSVP13,anime,,10,25.8,vegeta,glow,chalice_exclusive,164000
Funko Pop! Animation Dragonball Z Gohan (Training Outfit) Figure #383,F-POADZG83,anime,,10,18.6,gohan,no,no,67000
Funko Pop! Animation Dragonball Z Super Saiyan Trunks NYCC Figure #155,F-POADZSS55,anime,,10,61.8,super saiyan trunks,no,NYCC,1500
Funko Pop! Animation Naruto Shippuden Sasuke Curse Mark Figure #455,F-POANSSC55,anime,,9,58,sasuke,no,no,271000
Funko Pop! Animation Dragonball Z Perfect Cell (Glow) Spring Convention Exclusive Figure #759,F-POADZPC59,anime,,9,23.55555556,perfect cell,glow,spring_convention,14000
Funko Pop! Boruto Mitsuki (Sage Mode) (Glow) Hot Topic Exclusive Figure #699,F-POBMM99,anime,,8,34.75,mitsuki,glow,hot_topic_exclusive,68000
Funko Pop! Animation Dead Yamcha Summer Convention Figure #397,F-POADYSC97,anime,,7,24.42857143,dead yamcha,no,summer_convention,1000
Funko Pop! Animation DragonBall Z Majin Vegeta over9000.com Exclusive Figure #445,F-POADZMV45,anime,11/27/2018,10,61.8,vegeta,no,over9000_exclusive,164000
Funko Pop! Animation Naruto Shippuden Naruto (Rasengan) Figure #181,F-POANSN81,anime,,7,35.28571429,rasengan,no,no,48000
Funko Pop! Animation DragonBall Z Future Trunks (Chase) Hot Topic Exclusive Figure #639,F-POADZFT39,anime,,10,97.3,future trunks,no,hot_topic_exclusive,27000
Funko Pop! Animation My Hero Academia Deku (Battle) Figure #252,F-POAMHAD52,anime,,7,25.28571429,deku,no,no,451000
Funko Pop! Animation DragonBall Z Super Saiyan Vegeta Red Chrome Summer Convention Exclusive Figure #154,FPO-ADZSSVRCEF1,anime,,10,22.5,vegeta,no,summer_convention,164000
Funko Pop! Animation My Hero Academia Hero Killer Stain NYCC Figure #636,F-POAMHAH36,anime,,9,72.11111111,killer stain,no,NYCC,14000
Funko Pop! Animation My Hero Academia Todoroki Figure #372,F-POAMHAT72,anime,,7,27.28571429,todoroki,no,no,480000
Funko Pop! Animation Dragonball Z Super Saiyan 2 Gohan EB Exclusive Figure #518,F-POADZSS18,anime,,6,40.16666667,gohan,no,EB_exclusive,67000
Funko Pop! Animation My Hero Academia Deku in Onesie Game Stop Exclusive Figure #494,F-POAMHAD94,anime,,6,46,deku,no,gamestop_exclusive,451000
Funko Pop! Animation My Hero Academia Mystery Box Mystery Box,F-POAMHAMOX,anime,,6,69,mystery box,no,no,43000
Funko Pop! Animation Dragonball Z Piccolo Fall Convention Edition Figure #670,F-POADZPF70,anime,,6,30.66666667,piccolo,no,fall_convention,97000
Funko Pop! Animation Dragonball Z Super Saiyan 2 Vegeta PX Previews Exclusive Figure #709,F-POADZSS093,anime,,6,21.16666667,vegeta,no,previews_exclusive,164000
Funko Pop! Animation Dragonball Z Vegeta Figure #10,F-POADZVF10,anime,,6,27.16666667,vegeta,no,no,164000
Funko Pop! Animation Dragonball Z Super Saiyan Vegito AAA Anime Exclusive Figure #491,F-POADZSS915,anime,,6,23.66666667,vegeta,no,aaa_anime_exclusive,164000
Funko Pop! Animation Sailor Moon Sailor Mercury Figure #91,F-POASMSM91,anime,,6,85.83333333,sailor mercury,no,no,44000
Funko Pop! Animation My Hero Academia Mr.Compress NYCC Exclusive Figure #820,F-POAMHAM820,anime,10/8/2020,6,40.66666667,mr compress,no,NYCC,22000
Funko Pop! Animation Bleach Ichigo Kurosaki (Hollow) (Black and White) Gamestop Exclusive Figure #96,F-POABIK96,anime,12/23/2015,6,225.8333333,ichigo kurosaki,no,gamestop_exclusive,42000
Funko Pop! Animation DragonBall Z Frieza (Metallic) SDCC Figure #47,F-POADZF47,anime,5/18/2015,10,233.5,frieza,metallic,SDCC,76000
Funko Pop! Animation Dragonball Z Gotenks (Super Ghost Kamikaze Attack) Summer Convention Exclusive Figure #634,F-POADZG3,anime,,10,22.5,gotenks,no,summer_convention,17000
Funko Pop! Animation Dragonball Super Vegeta Poweing Up (Chase) Chalice Collectibles Exclusive Figure #713,F-POADSVP713,anime,,5,53.2,vegeta,no,chalice_exclusive,164000
Funko Pop! Animation Yu Yu Hakusho Hiei Funimation Exclusive Figure #547,F-POAYYHH47,anime,,6,40.33333333,hiei,no,funimation_exclusive,30000
Funko Pop! Animation My Hero Academia Himiko Toga AAA Anime Exclusive Figure #610,F-POAMHAH10,anime,,5,33.8,himiko toga,no,aaa_anime_exclusive,158000
Funko Pop! Animation Bleach Rukia Figure #60,F-POABRF60,anime,,6,123.3333333,rukia,no,no,31000
Funko Pop! Animation DragonBall Z Super Saiyan God Super Saiyan Vegeta (Metallic Blue) GameStop Exclusive Figure #156,F-POADZSS56,anime,10/5/2016,10,56.2,vegeta,metallic,gamestop_exclusive,164000
Funko Pop! Animation Dragonball Z Kid Buu Figure #620,F-POADZKB20,anime,,5,27.4,kid buu,no,no,24000
Funko Pop! Animation My Hero Academia Katsuki Bakugo SDCC Exclusive Figure #803,F-POAMHAK04,anime,7/22/2020,4,112,katsuki bakugo,no,SDCC,30000
Funko Pop! Animation Dragonball Z Android 18 Figure #530,F-POADZA130,anime,,4,18.75,android 18,no,no,81000
Funko Pop! Animation Dragonball Z Resurrection F Beerus SDCC Figure #120,F-POADZRFB20,anime,,4,190,beerus,no,SDCC,74000
Funko Pop! Animation Dragonball Z Vegeta (Chrome) 25 Years of Fun Funimation Figure #10,F-POADZV10,anime,,5,30.2,vegeta,no,funimation_exclusive,164000
Funko Pop! Animation Dragonball Z Frieza Figure #619,F-POADZFF19,anime,,6,20.33333333,frieza,no,no,76000
Funko Pop! Animation Naurto Shippuden Nauto Uzumaki Figure #727,F-POANSNU27,anime,,4,27.25,uzumaki,no,no,122000
Funko Pop! Animation Dragonball Z Super Saiyan 3 Goku EB Exclusive Figure #492,F-POADZSS927,anime,,4,40,goku,no,EB_exclusive,318000
Funko Pop! Animation Attack on Titan Female Titan Figure #233,F-POAAOTF33,anime,,4,119.75,female titan,no,no,28000
Funko Pop! Animation Yu Gi Oh! Blue-Eyes White Dragon Figure #389,F-POAYGO389,anime,,4,33,blue-eyes white dragon,no,no,4800
Funko Pop! Animation Dragonball Goku & Flying Nimbus (Chrome) 25 Years Funimation Exclusive Figure #109,F-POADGF099,anime,,4,31.25,goku,no,funimation_exclusive,318000
Funko Pop! Animation Dragonball Son Goku Funko Insider Club Figure #517,F-POADSGF17,anime,,4,25.5,goku,no,funko_insider_club,318000
Funko Pop! Animation DragonBall Z Broly (Super Saiyan) SDCC Figure #402,F-POADZB02,anime,11/27/2018,10,57.7,broly,no,SDCC,105000
Funko Pop! Animation Attack on Titan Cleaning Levi Hot Topic Exclusive Figure #239,F-POAAOTC39,anime,,5,63,cleaning levi,no,hot_topic_exclusive,1300
Funko Pop! Animation Attack the Titan Eren Jarger Bait Exclusive Figure #20,F-POAATTE20,anime,,4,91.5,eren jaeger,no,bait_exclusive,71000
Funko Pop! Animation Dragonball Super Whis Figure #317,F-POADSWF17,anime,,5,17.6,whis,no,no,30000
Funko Pop! Animation Dragonball Z Super Saiyan Gotenks AAA Anime Exclusive Figure #622,F-POADZSS228,anime,,3,25.66666667,gotenks,no,aaa_anime_exclusive,17000
Funko Pop! Animation Dragonball Z Perfect Cell Figure #13,F-POADZPC139,anime,,3,19.33333333,perfect cell,no,no,14000
Funko Pop! Animation Dragonball Z Planet Arlia Vegeta Toy Tokyo NYCC Figure #10,F-POADZPA10,anime,,3,2150,vegeta,no,tokyo_exclusive,164000
Funko Pop! Animation Naruto Shippeden Sakura Figure #183,F-POANSSF83,anime,,3,23.33333333,sakura,no,no,221000
Funko Pop! Animation Naruto Shippuden Kurama (Glow) GameStop Exclusive 6 Inch Figure #97,F-POANSK97,anime,,3,228.3333333,kurama,glow,gamestop_exclusive,101000
Funko Pop! Animation Sword Art Online Kiritom Hot Topic Exclusive Figure #82,F-POASAOK82,anime,,3,63.66666667,kirito,no,hot_topic_exclusive,112000
Funko Pop! Animation Dragonball Z Super Hit Toys R Us Exclusive Figure #315,F-POADZSH15,anime,,3,26,hit,no,toys_r_us_exclusive,49000
Funko Pop! Animation My Hero Academia Todoroki (Glow) Figure #372,F-POAMHATG72,anime,,4,29.25,todoroki,glow,no,480000
Funko Pop! Animation Attack on Titan Armin Arlelt FYE Exclusive Figure #237,F-POAAOTA37,anime,,3,88.66666667,armin arlert,no,fye_exclusive,53000
Funko Pop! Animation Naruto Shippuden Kaguya Otsutsuki NYCC Exlcusive Figure #179,F-POANSKO179,anime,10/8/2020,3,63,kaguya otsutsuki,no,NYCC,20000
Funko Pop! Animation My Hero Academia Fumikage Tokoyami Figure #607,F-POAMHAF07,anime,,3,23.33333333,fumikage tokoyami,no,no,13000
Funko Pop! Animationo Attack on Titan Eren (Titan Form) Hot Topic Exclusive Figure #22,F-POAAOTE2,anime,,3,178.3333333,eren jaeger,no,hot_topic_exclusive,71000
Funko Pop! Animation One Piece Portgas. D. Ace Figure #100,F-POAOPPD00,anime,,4,30.75,portgas d ace,no,no,18000
Funko Pop! Animation Dragonball Z Master Roshi (Peace Sign) FYE Exclusive Figure #381,F-POADZMR81,anime,,3,19.33333333,master roshi,no,fye_exclusive,50000
Funko Pop! Animation Dragonball Z Tien and Chiaotzu Figure #384,F-POADZTA84,anime,,4,17.75,chiaotzu,no,no,16000
Funko Pop! Animation Dragonball Z Vegeta SDCC Figure #10,F-POADZVS10,anime,,4,58.75,vegeta,no,SDCC,164000
Funko Pop! Animation My Hero Academia Tsuyu Figure #374,F-POAMHAT74,anime,,3,29.33333333,tsuyu,no,no,105000
Funko Pop! Animation Bleach Ichigo Figure #59,F-POABIF59,anime,,2,56,ichigo,no,no,67000
Funko Pop! Animation My Hero Academia Silver Age All Might (Glow) Hot Topic Exclusive Figure #608,F-POAMHASG08,anime,,2,41.5,all might,glow,hot_topic_exclusive,256000
Funko Pop! Animation My Hero Academia Endeavor Game Stop Exclusive Figure #495,F-POAMHAE95,anime,,2,32,endeavor,no,gamestop_exclusive,199000
Funko Pop! Animation Tokyo Ghoul Half-Kakuja Kaneki Figure #465,F-POATGHK65,anime,,2,40,half-kakuja kaneki,no,no,10
Funko Pop! Animation DragonBall Z Goku (w Nimbus) Galactic Toys Exclusive Figure #109,F-POADZG09,anime,9/29/2016,2,56.5,goku,no,galactic_toys_exclusive,318000
Funko Pop! Animation Dragonball Z Super Saiyan Goku Lootcrate Exclusive Figure #14,F-POADZSS146,anime,,2,45,goku,no,lootcrate_exclusive,318000
Funko Pop! Animation Dragonball Z Super Zen-Oh Galactic Toys Exclusive Figure #362,F-POADZSZ62,anime,,3,26.33333333,zen-oh,no,galactic_toys_exclusive,1600
Funko Pop! Animation Fullmetal Alchemist Alphonse Elric Figure #392,F-POAFAAE92,anime,,2,25,alphonse elric,no,no,24000
Funko Pop! Animation Dragonball Z Resurrection F Beerus Figure #120,F-POADZRFR20,anime,,2,60.5,beerus,no,no,74000
Funko Pop! Animation Dragonball Z Mecha Frieza Figure #705,F-POADZNF05,anime,,2,18.5,mecha frieza,no,no,2300
Funko Pop! Animation Fairytail Gajeel (Dragon Force) Spring Convention Edition Figure #481,F-POAFGF81,anime,,2,25,gajeel,no,spring_convention,12000
Funko Pop! Animation My Hero Academia Mei Hatsume Hot Topic Exclusive Figure #681,F-POAMHAM81,anime,,2,65,mei hatsume,no,hot_topic_exclusive,49000
Funko Pop! Aniamtion Death Note Light Figure #216,F-POADNLF16,anime,,2,73.5,light,no,no,404000
Funko Pop! Animation Dragonball Z Piccolo Figure #11,F-POADZPF11,anime,,3,19,piccolo,no,no,97000
Funko Pop! Animation Dragonball Z Master Roshi (Max Power) Funko Specialty Series Figure #533,F-POADZMR33,anime,,2,17.5,master roshi,no,funko_specialty_series,50000
Funko Pop! Animation My Hero Academia Mount Lady Hot Topic Exclusive 6 Inch Figure #612,F-POAMHAM12,anime,,2,43,mount lady,no,hot_topic_exclusive,12000
Funko Pop! Animation Dragonball Z Resurrection F Super Saiyan God Super Saiyan Vegeta Gamestop Exclusive Figure #156,F-POADZRF56,anime,,2,60,vegeta,no,gamestop_exclusive,164000
Funko Pop! Animation My Hero Academia Dabi NYCC Figure #637,F-POAMHAD37,anime,,3,198.3333333,dabi,no,NYCC,274000
Funko Pop! Animation One Piece TonyTony. Chopper Funimation Exclusive Figure #99,F-POAOPTC99,anime,,2,160,tony tony chopper,no,funimation_exclusive,36000
Funko Pop! Animation Sailor Moon Sailor Saturn Figure #299,F-POASMSS99,anime,,1,54,sailor saturn,no,no,48000
"Funko Pop! Animation One Piece Brook (w Guitar) Hot Topic, NYCC Exclusive Figure #358",F-POAOPB58,anime,8/3/2018,1,500,brook,no,NYCC,63000
Funko Pop! Animation Yu Gi Oh! Yami Yugi Figure #387,F-POAYGOY87,anime,,1,34,yami yugi,no,no,15000
Funko Pop! Animation Dragonball Z Super Saiyan 2 Vegeta (Glow) Chase PX Previews Exclusive Figure #709,F-POADZSS09,anime,,3,33,vegeta,glow,previews_exclusive,164000
Funko Pop! Animation Fullmetal Alchemist Edward Elric Figure #391,F-POAFAEE91,anime,,1,35,edward elric,no,no,72000
Funko Pop! Animation Sailor Moon Sailor Chibi Moon Figure #295,F-POASMSC95,anime,,1,70,sailor chibi moon,no,no,5300
Funko Pop! Animation Fairytail Swim Time Happy Hot Topic Exclusive Figure #286,F-POAFSTH86,anime,,1,30,swim time happy,no,hot_topic_exclusive,10
Funko Pop! Animation My Hero Academia Tomura Shigaraki Galactic Toys Exclusive Figure #565,F-POAMHAT65,anime,,1,35,tomura shigaraki,no,galactic_toys_exclusive,68000
